{
  "schema_version": "1.0",
  "session_id": "session-baijia-001",
  "turn_index": 1,
  "student_visible_reply": "严格管理会怎样改善你说的混乱局面？",
  "record_append": [
    {
      "turn_id": "turn-0002",
      "role": "student",
      "content": "我认为法家更合适，因为当时社会很乱，需要严格管理。"
    },
    {
      "turn_id": "turn-0003",
      "role": "assistant",
      "content": "严格管理会怎样改善你说的混乱局面？"
    }
  ],
  "internal_execution_record": {
    "contract_version": "1.0",
    "role_applied": "战国议政情境中的质询型谋士",
    "response_action": "ask_relation",
    "boundary_event": "none",
    "new_answer_content_introduced": false,
    "evaluation_or_diagnosis_given": false
  }
}
